{
  "schema_version": "1.0",
  "kind": "chatwoot_reconciliation_cursor_finalization_v1",
  "status": "ready",
  "reason_code": null,
  "source": "chatwoot_reconciliation_v1",
  "brand_id": "calapres",
  "account_id": 179973,
  "inbox_id": 128058,
  "channel": "whatsapp",
  "conversation_id": "7001",
  "expected_after_message_id": 99,
  "new_after_message_id": 101,
  "activation_floor_at": "2026-08-12T00:00:00.000Z",
  "activation_policy_version": "2026-08-12-v1",
  "proof_rows": [
    {
      "message_id": "100",
      "classification": "deterministically_excluded",
      "outcome": "deterministically_excluded",
      "reason_code": "before_activation_floor",
      "created_at": 1786492799,
      "message_type": 0,
      "private": false,
      "sender_type": "contact",
      "event_identity_key_version": null,
      "event_identity_fingerprint": null,
      "business_claim_id": null,
      "job_id": null,
      "generation": null
    },
    {
      "message_id": "101",
      "classification": "event_candidate",
      "outcome": "durable_bound",
      "reason_code": null,
      "created_at": null,
      "message_type": null,
      "private": null,
      "sender_type": null,
      "event_identity_key_version": "calapres-identity-hmac-v1",
      "event_identity_fingerprint": "cccccccccccccccccccccccccccccccccccccccccccccccccccccccccccccccc",
      "business_claim_id": "bev_claim_msg_101",
      "job_id": "job_calapres_101",
      "generation": 1
    }
  ],
  "page_binding_sha256": "806e6c85eb14d19f43a4ae67e93233d74cec12bb5fcaa42419d0e5d7dd72038f",
  "outcome_digest": "a2b7575da0358784e434effb35c917104ddbd19827ebcff884f6b7b759dcdb81",
  "row_count": 2,
  "cursor_advance_ready": true,
  "continue_required": false,
  "no_loss_claimed": false,
  "customer_egress_allowed": false
}
